[
  {
    "id": "CHK-01",
    "sourceVersion": "3.9.5",
    "checkpointVersion": "4.0.0",
    "title": {
      "en-US": "Inventory and eligibility of Arc machines",
      "pt-BR": "Inventário e elegibilidade das máquinas Arc"
    },
    "domain": "A",
    "severity": "Low",
    "assessmentType": "auto",
    "owner": "Platform",
    "zeroTrust": {
      "principles": [
        "verify-explicitly"
      ],
      "pillars": [
        "Endpoints"
      ]
    },
    "securityScopes": [
      "T2"
    ],
    "riskIds": [
      "R09",
      "R10"
    ],
    "scenarioIds": [
      "AS09",
      "AS10"
    ],
    "securityBoundaryIds": [
      "SB04",
      "SB06",
      "SB08"
    ],
    "defenseFunctions": [
      "Detect"
    ],
    "securityModelStage": "DEFENSE",
    "claim": {
      "claimType": "inventory",
      "evidenceRequired": [
        "machines",
        "scope",
        "timestamp",
        "source"
      ],
      "absenceMeans": "NOT_OBSERVED",
      "evaluationRule": "Evidence must be scoped, timestamped, attributable to a source, and must satisfy resultCriteria; absence is never interpreted as PASS."
    },
    "mappingConfidence": "high",
    "sourceRefs": {
      "requirements": [
        "REQ-01"
      ],
      "mcsb": [
        "AM-1"
      ],
      "decisionTree": "D1",
      "datasets": [
        "machines"
      ]
    },
    "resultCriteria": "INFO by design (inventory, not scored): counts Arc machines by connection status, OS and SQL detection; this inventory is the denominator for the other checks."
  },
  {
    "id": "CHK-02",
    "sourceVersion": "3.9.5",
    "checkpointVersion": "4.0.0",
    "title": {
      "en-US": "Arc service per environment type",
      "pt-BR": "Serviço Arc por tipo de ambiente"
    },
    "domain": "A",
    "severity": "Medium",
    "assessmentType": "manual",
    "owner": "Architecture",
    "zeroTrust": {
      "principles": [
        "verify-explicitly"
      ],
      "pillars": [
        "Apps"
      ]
    },
    "securityScopes": [
      "T2",
      "Global"
    ],
    "riskIds": [
      "R02",
      "R09"
    ],
    "scenarioIds": [
      "AS02",
      "AS09"
    ],
    "securityBoundaryIds": [
      "SB02",
      "SB08"
    ],
    "defenseFunctions": [
      "Prevent"
    ],
    "securityModelStage": "MANAGEMENT",
    "claim": {
      "claimType": "documentary",
      "evidenceRequired": [
        "scope",
        "timestamp",
        "source"
      ],
      "absenceMeans": "UNKNOWN",
      "evaluationRule": "Evidence must be scoped, timestamped, attributable to a source, and must satisfy resultCriteria; absence is never interpreted as PASS."
    },
    "mappingConfidence": "high",
    "sourceRefs": {
      "requirements": [
        "DEC-01",
        "DEC-02"
      ],
      "mcsb": [
        "AM-2"
      ],
      "decisionTree": "D1",
      "datasets": []
    },
    "resultCriteria": "PASS when the Arc service used for each environment type (servers, SQL Server, Kubernetes, VMware/SCVMM) is documented with an owner; WARN when only part of the environments is covered. TODO until the customer's documentary evidence is recorded."
  },
  {
    "id": "CHK-03",
    "sourceVersion": "3.9.5",
    "checkpointVersion": "4.0.0",
    "title": {
      "en-US": "Landing zone and resource organization",
      "pt-BR": "Landing zone e organização de recursos"
    },
    "domain": "A",
    "severity": "Medium",
    "assessmentType": "manual",
    "owner": "Architecture",
    "zeroTrust": {
      "principles": [
        "verify-explicitly"
      ],
      "pillars": [
        "Infrastructure"
      ]
    },
    "securityScopes": [
      "Global"
    ],
    "riskIds": [
      "R09"
    ],
    "scenarioIds": [
      "AS09"
    ],
    "securityBoundaryIds": [
      "SB02",
      "SB08"
    ],
    "defenseFunctions": [
      "Prevent"
    ],
    "securityModelStage": "MANAGEMENT",
    "claim": {
      "claimType": "documentary",
      "evidenceRequired": [
        "scope",
        "timestamp",
        "source"
      ],
      "absenceMeans": "UNKNOWN",
      "evaluationRule": "Evidence must be scoped, timestamped, attributable to a source, and must satisfy resultCriteria; absence is never interpreted as PASS."
    },
    "mappingConfidence": "high",
    "sourceRefs": {
      "requirements": [
        "DEC-03"
      ],
      "mcsb": [
        "AM-1",
        "AM-3"
      ],
      "decisionTree": "D2",
      "datasets": []
    },
    "resultCriteria": "PASS when Arc resources follow a documented landing zone (management group, subscription, resource group and naming standard); WARN when the design exists but is not applied to every Arc resource. TODO until the customer's documentary evidence is recorded."
  },
  {
    "id": "CHK-04",
    "sourceVersion": "3.9.5",
    "checkpointVersion": "4.0.0",
    "title": {
      "en-US": "Criticality profile (Tier 0/1/2)",
      "pt-BR": "Perfil de criticidade (Tier 0/1/2)"
    },
    "domain": "A",
    "severity": "High",
    "assessmentType": "manual",
    "owner": "Security",
    "zeroTrust": {
      "principles": [
        "verify-explicitly"
      ],
      "pillars": [
        "Infrastructure"
      ]
    },
    "securityScopes": [
      "T1",
      "Global"
    ],
    "riskIds": [
      "R09"
    ],
    "scenarioIds": [
      "AS09"
    ],
    "securityBoundaryIds": [
      "SB02",
      "SB08"
    ],
    "defenseFunctions": [
      "Prevent"
    ],
    "securityModelStage": "MANAGEMENT",
    "claim": {
      "claimType": "documentary",
      "evidenceRequired": [
        "scope",
        "timestamp",
        "source"
      ],
      "absenceMeans": "UNKNOWN",
      "evaluationRule": "Evidence must be scoped, timestamped, attributable to a source, and must satisfy resultCriteria; absence is never interpreted as PASS."
    },
    "mappingConfidence": "high",
    "sourceRefs": {
      "requirements": [
        "DEC-04"
      ],
      "mcsb": [
        "AM-1",
        "PA-1"
      ],
      "decisionTree": "D2",
      "datasets": []
    },
    "resultCriteria": "PASS when every Arc machine has a documented tier (0/1/2) that drives controls; WARN when some machines have no tier; FAIL when Tier 0 assets are not identified. TODO until the customer's documentary evidence is recorded."
  },
  {
    "id": "CHK-05",
    "sourceVersion": "3.9.5",
    "checkpointVersion": "4.0.0",
    "title": {
      "en-US": "Metadata region and data residency",
      "pt-BR": "Região dos metadados e residência de dados"
    },
    "domain": "A",
    "severity": "Medium",
    "assessmentType": "auto",
    "owner": "Governance",
    "zeroTrust": {
      "principles": [
        "verify-explicitly"
      ],
      "pillars": [
        "Data"
      ]
    },
    "securityScopes": [
      "T2",
      "Global"
    ],
    "riskIds": [
      "R09"
    ],
    "scenarioIds": [
      "AS09"
    ],
    "securityBoundaryIds": [
      "SB02",
      "SB08"
    ],
    "defenseFunctions": [
      "Prevent"
    ],
    "securityModelStage": "MANAGEMENT",
    "claim": {
      "claimType": "inventory",
      "evidenceRequired": [
        "machines",
        "scope",
        "timestamp",
        "source"
      ],
      "absenceMeans": "NOT_OBSERVED",
      "evaluationRule": "Evidence must be scoped, timestamped, attributable to a source, and must satisfy resultCriteria; absence is never interpreted as PASS."
    },
    "mappingConfidence": "high",
    "sourceRefs": {
      "requirements": [
        "CTL-08"
      ],
      "mcsb": [
        "AM-2"
      ],
      "decisionTree": "D2",
      "datasets": [
        "machines"
      ]
    },
    "resultCriteria": "PARTIAL when the allowed-region/data-residency policy is not supplied (regions are only listed, so compliance cannot be concluded); WARN if any machine is outside the allowed regions; PASS when every machine is inside them."
  },
  {
    "id": "CHK-06",
    "sourceVersion": "3.9.5",
    "checkpointVersion": "4.0.0",
    "title": {
      "en-US": "Recommended tags (best practice)",
      "pt-BR": "Tags recomendadas (boa prática)"
    },
    "domain": "B",
    "severity": "Low",
    "assessmentType": "auto",
    "owner": "Governance",
    "zeroTrust": {
      "principles": [
        "verify-explicitly"
      ],
      "pillars": [
        "Infrastructure"
      ]
    },
    "securityScopes": [
      "T2"
    ],
    "riskIds": [
      "R09"
    ],
    "scenarioIds": [
      "AS09"
    ],
    "securityBoundaryIds": [
      "SB02",
      "SB08"
    ],
    "defenseFunctions": [
      "Prevent"
    ],
    "securityModelStage": "MANAGEMENT",
    "claim": {
      "claimType": "inventory",
      "evidenceRequired": [
        "machines",
        "scope",
        "timestamp",
        "source"
      ],
      "absenceMeans": "NOT_OBSERVED",
      "evaluationRule": "Evidence must be scoped, timestamped, attributable to a source, and must satisfy resultCriteria; absence is never interpreted as PASS."
    },
    "mappingConfidence": "high",
    "sourceRefs": {
      "requirements": [
        "REQ-02"
      ],
      "mcsb": [
        "AM-1"
      ],
      "decisionTree": "D2",
      "datasets": [
        "machines"
      ]
    },
    "resultCriteria": "INFO by design (best practice, not scored): counts machines missing at least one of the tags env, owner, criticality, costCenter, dataClassification and patchWindow."
  },
  {
    "id": "CHK-07",
    "sourceVersion": "3.9.5",
    "checkpointVersion": "4.0.0",
    "title": {
      "en-US": "Registered resource providers",
      "pt-BR": "Resource providers registrados"
    },
    "domain": "B",
    "severity": "Medium",
    "assessmentType": "auto",
    "owner": "Platform",
    "zeroTrust": {
      "principles": [
        "verify-explicitly"
      ],
      "pillars": [
        "Infrastructure"
      ]
    },
    "securityScopes": [
      "T2"
    ],
    "riskIds": [
      "R02",
      "R09"
    ],
    "scenarioIds": [
      "AS02",
      "AS09"
    ],
    "securityBoundaryIds": [
      "SB02",
      "SB08"